{
  "meta": {
    "title": "律令国家の成立 史実クロニクルタイムライン (645年〜802年)",
    "description": "乙巳の変・大化の改新から、壬申の乱、大宝律令の制定、平城京遷都、長屋王の変、藤原広嗣の乱、聖武天皇による大仏建立、恵美押勝の乱、道鏡の専権と宇佐八幡宮神託事件、桓武天皇による平安京遷都、そして蝦夷の指導者・阿弖流爲の降伏に至るまで。中央集権的な律令国家が形づくられていく157年間をインタラクティブなタイムラインで体験。",
    "headerIcon": "🏛️",
    "headerTitle": "律令国家の成立",
    "headerSubtitle": "645年〜802年",
    "searchPlaceholder": "🔍 出来事・人物を検索…",
    "mapTitleIcon": "🗾",
    "mapTitleLabel": "勢力図",
    "characterTitleLabel": "別名",
    "descLabel": "📖 史実の記録",
    "charDescLabel": "📖 人物伝",
    "relatedCharsLabel": "👥 関連人物（クリックで詳細）",
    "relatedEventsLabel": "📅 関連する出来事（クリックで詳細）",
    "triviaLabel": "📜 補足・豆知識",
    "layoutStyle": "rail",
    "mapLayout": [
      [null, "mutsu", null],
      ["yamashiro", "yamato", "oumi"],
      [null, "dazaifu", null]
    ]
  },
  "eraPhases": [
    { "id": 1, "name": "第一章：大化の改新と乙巳の変", "period": "645 〜 663", "startYear": 645, "endYear": 663 },
    { "id": 2, "name": "第二章：壬申の乱と天武・持統の治世", "period": "672 〜 701", "startYear": 672, "endYear": 701 },
    { "id": 3, "name": "第三章：平城京と長屋王の変", "period": "708 〜 729", "startYear": 708, "endYear": 729 },
    { "id": 4, "name": "第四章：天然痘禍と藤原広嗣の乱", "period": "735 〜 740", "startYear": 735, "endYear": 740 },
    { "id": 5, "name": "第五章：聖武天皇の彷徨と大仏建立", "period": "740 〜 752", "startYear": 740, "endYear": 752 },
    { "id": 6, "name": "第六章：橘奈良麻呂の変と恵美押勝の乱", "period": "749 〜 764", "startYear": 749, "endYear": 764 },
    { "id": 7, "name": "第七章：道鏡の専権と宇佐八幡宮神託事件", "period": "764 〜 770", "startYear": 764, "endYear": 770 },
    { "id": 8, "name": "第八章：桓武天皇と平安京遷都", "period": "781 〜 794", "startYear": 781, "endYear": 794 },
    { "id": 9, "name": "第九章：蝦夷との攻防、阿弖流爲の降伏", "period": "780 〜 802", "startYear": 780, "endYear": 802 }
  ],
  "factions": {
    "soga": { "id": "soga", "name": "蘇我氏", "color": "#2a4a2a", "colorLight": "#6a9a5a" },
    "court": { "id": "court", "name": "朝廷", "color": "#5a4a12", "colorLight": "#b89a3a" },
    "fujiwara": { "id": "fujiwara", "name": "藤原氏", "color": "#3a2a5a", "colorLight": "#8a6ac4" },
    "tachibana": { "id": "tachibana", "name": "橘氏", "color": "#7a4a1a", "colorLight": "#c48a4a" },
    "dokyo": { "id": "dokyo", "name": "道鏡派", "color": "#5a1a2a", "colorLight": "#a04a5a" },
    "emishi": { "id": "emishi", "name": "蝦夷", "color": "#2a3a3a", "colorLight": "#5a8a8a" },
    "other": { "id": "other", "name": "その他", "color": "#4a4a4a", "colorLight": "#9a9a9a" }
  },
  "categories": {
    "battle": { "id": "battle", "name": "合戦", "icon": "⚔️" },
    "politics": { "id": "politics", "name": "政変", "icon": "👑" },
    "episode": { "id": "episode", "name": "逸話", "icon": "📜" },
    "death": { "id": "death", "name": "死没", "icon": "💀" }
  },
  "characters": [
    { "id": "c_soga_no_iruka", "name": "蘇我入鹿", "reading": "そがのいるか", "faction": "soga", "role": "大臣", "life": "?-645", "field": "governance", "description": "蘇我氏の全盛期を築いた蘇我蝦夷の子。聖徳太子の子・山背大兄王一族を滅ぼすなど強引な手法で権勢を振るい、皇室をも凌ぐ勢いを見せた。しかしその専横を危険視した中大兄皇子と中臣鎌足によって、飛鳥板蓋宮での儀式の最中に暗殺された。" },
    { "id": "c_soga_no_emishi", "name": "蘇我蝦夷", "reading": "そがのえみし", "faction": "soga", "role": "大臣", "life": "?-645", "field": "governance", "description": "入鹿の父で、蘇我氏の家長として朝廷の実権を長く握った。子の入鹿が暗殺されたと知ると、もはや抵抗の術なしと悟り、自邸に火を放って一族ともども自害した。これにより権勢を誇った蘇我本宗家は滅亡した。" },
    { "id": "c_naka_no_oe", "name": "中大兄皇子（天智天皇）", "reading": "なかのおおえのおうじ", "faction": "court", "role": "皇太子／第38代天皇", "life": "626-672", "field": "governance", "description": "中臣鎌足と謀り、宮中で蘇我入鹿を自ら斬りつけて討った乙巳の変の首謀者。以後、皇太子として大化の改新を主導し、白村江の敗戦を経て近江大津宮に遷都、即位して天智天皇となった。日本初の全国的な戸籍・近江令の編纂に着手するなど、中央集権化を大きく前進させた。" },
    { "id": "c_nakatomi_no_kamatari", "name": "中臣鎌足（藤原鎌足）", "reading": "なかとみのかまたり", "faction": "fujiwara", "role": "内臣", "life": "614-669", "field": "governance", "description": "中大兄皇子と共に乙巳の変を計画・実行し、蘇我氏打倒の立役者となった。以後は内臣として改新政治を支え続け、死の直前に天智天皇から「藤原」の姓を賜った。これが後に朝廷を数百年にわたり左右する藤原氏の始まりとなる。" },
    { "id": "c_koutoku_tennou", "name": "孝徳天皇", "reading": "こうとくてんのう", "faction": "court", "role": "第36代天皇", "life": "596-654", "field": "governance", "description": "乙巳の変の直後、皇極天皇の譲位を受けて即位した。難波長柄豊碕宮に遷都し、「改新の詔」を発して公地公民制・班田収授法など律令国家建設の基本方針を打ち出した、大化の改新を名目上主導した天皇。" },
    { "id": "c_temmu_tennou", "name": "天武天皇（大海人皇子）", "reading": "てんむてんのう", "faction": "court", "role": "皇弟／第40代天皇", "life": "?-686", "field": "governance", "description": "天智天皇の弟。兄の死後、皇位継承をめぐって甥の大友皇子と激突した壬申の乱に勝利し即位した。強大な皇親政治を敷き、飛鳥浄御原令の編纂や『日本書紀』編纂の勅命など、律令国家の骨格を築いた中興の天皇。" },
    { "id": "c_koubun_tennou", "name": "大友皇子（弘文天皇）", "reading": "おおとものみこ", "faction": "court", "role": "太政大臣／皇太子", "life": "648-672", "field": "governance", "description": "天智天皇の皇子で、父の死後に朝廷を率いたが、叔父の大海人皇子が挙兵すると劣勢に陥り、瀬田橋の戦いに敗れて自害した。壬申の乱における敗者であり、明治時代に至って「弘文天皇」の諡号を追贈された。" },
    { "id": "c_jitou_tennou", "name": "持統天皇", "reading": "じとうてんのう", "faction": "court", "role": "第41代天皇", "life": "645-703", "field": "governance", "description": "天智天皇の皇女で天武天皇の皇后。夫の崩御後、皇太子であった草壁皇子の早世を経て自ら即位し、藤原京への遷都を断行した。夫の遺志を継いで律令制定事業を推し進め、律令国家の礎を固めた。" },
    { "id": "c_fujiwara_no_fuhito", "name": "藤原不比等", "reading": "ふじわらのふひと", "faction": "fujiwara", "role": "右大臣", "life": "659-720", "field": "administration", "description": "鎌足の子で、藤原氏を中央政界の頂点に押し上げた実質的な始祖。刑部親王らと共に大宝律令の編纂を主導し、日本を名実共に法治国家へと変貌させた。娘を天皇家に嫁がせる外戚政策も進め、以後数百年続く藤原氏繁栄の基盤を作った。" },
    { "id": "c_kakinomoto_no_hitomaro", "name": "柿本人麻呂", "reading": "かきのもとのひとまろ", "faction": "court", "role": "宮廷歌人", "life": "生没年不詳（7世紀後半〜8世紀初頭）", "field": "arts", "description": "持統・文武朝を中心に活躍した宮廷歌人。天皇の吉野行幸に随行して王権を讃える歌を詠み、荒廃した近江大津宮の跡を訪れて壬申の乱の記憶を悼む歌も残した。天皇の権威を言葉によって支える、律令国家の公的な場で機能した歌人である。" },
    { "id": "c_genmei_tennou", "name": "元明天皇", "reading": "げんめいてんのう", "faction": "court", "role": "第43代天皇", "life": "661-721", "field": "governance", "description": "持統天皇の異母妹にあたり、孫の首皇子（後の聖武天皇）が幼少であったため中継ぎとして即位した。より広大で恒久的な都を求めて平城京への遷都を断行し、『古事記』編纂の事業を命じるなど、奈良時代の幕開けを整えた。" },
    { "id": "c_nagaya_ou", "name": "長屋王", "reading": "ながやおう", "faction": "court", "role": "左大臣", "life": "684-729", "field": "governance", "description": "天武天皇の孫にあたる皇族で、藤原不比等の死後、左大臣として朝政を主導した。三世一身法を制定するなど手腕を発揮したが、藤原四兄弟によって謀反の疑いをかけられ、邸宅を包囲されて妻子もろとも自害に追い込まれた。" },
    { "id": "c_oo_no_yasumaro", "name": "太安万侶", "reading": "おおのやすまろ", "faction": "court", "role": "官人・編纂者", "life": "?-723", "field": "scholarship", "description": "稗田阿礼が誦習していた神話・伝承を筆録し、日本最古の歴史書『古事記』を完成させた。天皇の系譜と国の起こりを一つの物語として書き記したこの仕事は、律令国家が自らの正統性を語る基礎資料となった。" },
    { "id": "c_toneri_shinnou", "name": "舎人親王", "reading": "とねりしんのう", "faction": "court", "role": "知太政官事", "life": "676-735", "field": "scholarship", "description": "天武天皇の皇子で、勅命を受けて編纂事業の総責任者を務め、漢文の編年体で書かれた正史『日本書紀』全30巻を完成させた。国家の公式な歴史として、以後の律令国家の自己認識を長く規定する仕事を成し遂げた。" },
    { "id": "c_fujiwara_no_muchimaro", "name": "藤原武智麻呂", "reading": "ふじわらのむちまろ", "faction": "fujiwara", "role": "左大臣（藤原四兄弟・南家祖）", "life": "680-737", "field": "governance", "description": "不比等の長男で藤原南家の祖。弟たちと共に長屋王を陥れ、その死後は兄弟で朝廷の要職を独占して藤原氏の全盛を築いた。しかし737年、都を襲った天然痘の大流行によって、四兄弟は次々と病に倒れていくことになる。" },
    { "id": "c_tachibana_no_moroe", "name": "橘諸兄", "reading": "たちばなのもろえ", "faction": "tachibana", "role": "右大臣・左大臣", "life": "684-757", "field": "governance", "description": "皇族出身ながら臣籍降下して橘氏を名乗った。藤原四兄弟が天然痘で相次いで病没すると、代わって朝廷の中心に立ち、唐帰りの吉備真備・玄昉を重用して新しい政治を進めた。だが藤原広嗣の乱でその政権基盤を早くも揺さぶられることになる。" },
    { "id": "c_kibi_no_makibi", "name": "吉備真備", "reading": "きびのまきび", "faction": "court", "role": "遣唐留学生・学者", "life": "695-775", "field": "scholarship", "description": "17年に及ぶ唐への留学から、天文・暦学・音楽・兵法など膨大な知識を携えて帰国した稀代の学者。橘諸兄政権の中枢に迎えられて重用されたが、その台頭は反発を招き、後に藤原広嗣の乱の一因ともなった。" },
    { "id": "c_genbou", "name": "玄昉", "reading": "げんぼう", "faction": "court", "role": "僧・内道場僧", "life": "?-746", "field": "thought", "description": "吉備真備と同じ遣唐使船で唐に渡り、多くの経典を携えて帰国した学僧。聖武天皇や光明皇后の厚い信任を得て内道場に迎えられ仏教政策を主導したが、真備と並んで藤原広嗣の乱で標的とされた人物である。" },
    { "id": "c_fujiwara_no_hirotsugu", "name": "藤原広嗣", "reading": "ふじわらのひろつぐ", "faction": "fujiwara", "role": "大宰少弐（藤原式家）", "life": "?-740", "field": "military", "description": "藤原四兄弟の一人・宇合の子。大宰府に左遷されたことへの不満から、朝廷の混乱の元凶は吉備真備と玄昉であるとしてその排除を求め、九州で大規模な反乱を起こした。しかし追討軍に敗れ、逃亡先で捕らえられて斬られた。" },
    { "id": "c_shoumu_tennou", "name": "聖武天皇", "reading": "しょうむてんのう", "faction": "court", "role": "第45代天皇", "life": "701-756", "field": "governance", "description": "相次ぐ疫病・飢饉・反乱に深く心を痛め、仏教の力によって国を鎮めようと願った天皇。恭仁京・難波京・紫香楽宮と都を転々とする「彷徨五年」を経て平城京に戻り、東大寺に盧舎那大仏を造立する一大事業を成し遂げた。" },
    { "id": "c_koumyou_kougou", "name": "光明皇后", "reading": "こうみょうこうごう", "faction": "court", "role": "皇后", "life": "701-760", "field": "governance", "description": "藤原不比等の娘で、皇族以外から立后した最初の例となった聖武天皇の皇后。貧民や孤児を救う悲田院、医療施設の施薬院を設けるなど社会事業に力を注ぎ、夫と共に大仏造立事業を強く後押しした。" },
    { "id": "c_gyouki", "name": "行基", "reading": "ぎょうき", "faction": "other", "role": "民間布教僧", "life": "668-749", "field": "thought", "description": "朝廷の許可を得ない民間布教を行いつつ、橋や用水路を各地に築いて民衆の絶大な支持を集めた僧。当初は朝廷から弾圧されたが、大仏造立に際してはその動員力が不可欠と見なされ、聖武天皇自ら協力を要請するに至った。" },
    { "id": "c_roben", "name": "良弁", "reading": "ろうべん", "faction": "court", "role": "東大寺初代別当", "life": "689-773", "field": "thought", "description": "聖武天皇の信任を受けて東大寺建立の実務を統括した僧。大仏開眼供養の儀式を取り仕切り、初代別当として東大寺の基礎を築いた、国家仏教の実務面を支えた中心人物である。" },
    { "id": "c_kouken_tennou", "name": "孝謙天皇", "reading": "こうけんてんのう", "faction": "court", "role": "第46代天皇", "life": "718-770", "field": "governance", "description": "聖武天皇と光明皇后の娘で、女性として即位した。当初は藤原仲麻呂を重用したが、後に僧・道鏡を寵愛するようになり仲麻呂と対立、乱を退けて重祚（再度の即位）した後は称徳天皇として道鏡を重用する専制的な政治を敷いた。" },
    { "id": "c_fujiwara_no_nakamaro", "name": "藤原仲麻呂（恵美押勝）", "reading": "ふじわらのなかまろ", "faction": "fujiwara", "role": "太師（太政大臣）", "life": "706-764", "field": "governance", "description": "武智麻呂の子で、孝謙天皇・光明皇太后の信任を背景に太政大臣にまで昇り、淳仁天皇を擁立して「恵美押勝」の名を賜るほどの権勢を誇った。しかし道鏡の台頭により孝謙上皇との関係が悪化すると挙兵に踏み切り、追討されて近江で敗死した。" },
    { "id": "c_tachibana_no_naramaro", "name": "橘奈良麻呂", "reading": "たちばなのならまろ", "faction": "tachibana", "role": "参議（橘諸兄の子）", "life": "721-757", "field": "governance", "description": "橘諸兄の子で、父の失脚後に強まる藤原仲麻呂の専権に危機感を抱き、これを打倒する謀反を計画した。しかし事前に発覚して一味もろとも捕らえられ、厳しい拷問の末に獄中で命を落とした。" },